{
 "schema": "visitflow/solution",
 "version": "1.0",
 "problem_hash": "sha256:59ea524c10eead0098acd9b6d2a91adc860ebb4f64aea2d887647d17e71163d2",
 "model_hash": "sha256:46c9f57b29a17d8562377adb0980018df39d14e4b5829882e78ef5a8ccc8a375",
 "status": "FAILED",
 "assignment": {
  "1": {
   "route_idx": [
    22,
    12,
    17,
    7,
    2
   ],
   "route_codes": [
    "600001115",
    "999086338",
    "20000151934",
    "990070109",
    "660420158"
   ],
   "km": 29.471
  },
  "2": {
   "route_idx": [
    13,
    8,
    3,
    18,
    23
   ],
   "route_codes": [
    "999146801",
    "990070110",
    "660478471",
    "20000152103",
    "660254631"
   ],
   "km": 24.806
  },
  "3": {
   "route_idx": [
    21,
    16,
    6,
    1,
    11
   ],
   "route_codes": [
    "600000664",
    "20000136135",
    "990069559",
    "660300561",
    "990070140"
   ],
   "km": 38.442
  },
  "4": {
   "route_idx": [
    22,
    12,
    17,
    7,
    2
   ],
   "route_codes": [
    "600001115",
    "999086338",
    "20000151934",
    "990070109",
    "660420158"
   ],
   "km": 29.471
  },
  "5": {
   "route_idx": [
    13,
    8,
    3,
    18,
    23
   ],
   "route_codes": [
    "999146801",
    "990070110",
    "660478471",
    "20000152103",
    "660254631"
   ],
   "km": 24.806
  },
  "6": {
   "route_idx": [
    21,
    16,
    6,
    1,
    11
   ],
   "route_codes": [
    "600000664",
    "20000136135",
    "990069559",
    "660300561",
    "990070140"
   ],
   "km": 38.442
  },
  "7": {
   "route_idx": [
    22,
    12,
    17,
    7,
    2
   ],
   "route_codes": [
    "600001115",
    "999086338",
    "20000151934",
    "990070109",
    "660420158"
   ],
   "km": 29.471
  },
  "8": {
   "route_idx": [
    13,
    8,
    3,
    18,
    23
   ],
   "route_codes": [
    "999146801",
    "990070110",
    "660478471",
    "20000152103",
    "660254631"
   ],
   "km": 24.806
  },
  "9": {
   "route_idx": [
    21,
    16,
    6,
    1,
    11
   ],
   "route_codes": [
    "600000664",
    "20000136135",
    "990069559",
    "660300561",
    "990070140"
   ],
   "km": 38.442
  },
  "10": {
   "route_idx": [
    22,
    12,
    17,
    7,
    2
   ],
   "route_codes": [
    "600001115",
    "999086338",
    "20000151934",
    "990070109",
    "660420158"
   ],
   "km": 29.471
  },
  "11": {
   "route_idx": [
    13,
    8,
    3,
    18,
    23
   ],
   "route_codes": [
    "999146801",
    "990070110",
    "660478471",
    "20000152103",
    "660254631"
   ],
   "km": 24.806
  },
  "12": {
   "route_idx": [
    21,
    16,
    6,
    1,
    11
   ],
   "route_codes": [
    "600000664",
    "20000136135",
    "990069559",
    "660300561",
    "990070140"
   ],
   "km": 38.442
  },
  "13": {
   "route_idx": [
    22,
    12,
    7,
    17,
    2
   ],
   "route_codes": [
    "600001115",
    "999086338",
    "990070109",
    "20000151934",
    "660420158"
   ],
   "km": 29.472
  },
  "14": {
   "route_idx": [
    13,
    8,
    3,
    18,
    23
   ],
   "route_codes": [
    "999146801",
    "990070110",
    "660478471",
    "20000152103",
    "660254631"
   ],
   "km": 24.806
  },
  "15": {
   "route_idx": [
    21,
    16,
    6,
    1,
    11
   ],
   "route_codes": [
    "600000664",
    "20000136135",
    "990069559",
    "660300561",
    "990070140"
   ],
   "km": 38.442
  },
  "16": {
   "route_idx": [
    22,
    12,
    17,
    7,
    2
   ],
   "route_codes": [
    "600001115",
    "999086338",
    "20000151934",
    "990070109",
    "660420158"
   ],
   "km": 29.471
  },
  "17": {
   "route_idx": [
    13,
    8,
    3,
    18,
    23
   ],
   "route_codes": [
    "999146801",
    "990070110",
    "660478471",
    "20000152103",
    "660254631"
   ],
   "km": 24.806
  },
  "18": {
   "route_idx": [
    21,
    16,
    6,
    1,
    11
   ],
   "route_codes": [
    "600000664",
    "20000136135",
    "990069559",
    "660300561",
    "990070140"
   ],
   "km": 38.442
  },
  "19": {
   "route_idx": [
    22,
    12,
    17,
    7,
    2
   ],
   "route_codes": [
    "600001115",
    "999086338",
    "20000151934",
    "990070109",
    "660420158"
   ],
   "km": 29.471
  },
  "20": {
   "route_idx": [
    13,
    8,
    3,
    18,
    23
   ],
   "route_codes": [
    "999146801",
    "990070110",
    "660478471",
    "20000152103",
    "660254631"
   ],
   "km": 24.806
  },
  "21": {
   "route_idx": [
    21,
    16,
    6,
    1,
    11
   ],
   "route_codes": [
    "600000664",
    "20000136135",
    "990069559",
    "660300561",
    "990070140"
   ],
   "km": 38.442
  },
  "22": {
   "route_idx": [
    22,
    12,
    17,
    7,
    2
   ],
   "route_codes": [
    "600001115",
    "999086338",
    "20000151934",
    "990070109",
    "660420158"
   ],
   "km": 29.471
  },
  "23": {
   "route_idx": [
    13,
    8,
    3,
    18,
    23
   ],
   "route_codes": [
    "999146801",
    "990070110",
    "660478471",
    "20000152103",
    "660254631"
   ],
   "km": 24.806
  }
 },
 "totals": {
  "km": 703.312,
  "vs_original_pct": -26.738,
  "moved_stores": 95
 },
 "gates": {
  "count_ok": false,
  "capacity_ok": false,
  "r2_ok": true,
  "contract_ok": true,
  "structure_ok": true
 },
 "runtime": {
  "engine": "r2_alns",
  "engine_version": "git:0e45f13",
  "stage_versions": {},
  "seeds": [
   42
  ],
  "budget_s": 30.0,
  "iters": 18000,
  "wall_sec": 1.55
 },
 "certificates": {
  "pool_lp": null,
  "certified_global_lb": null,
  "global_gap_pct": null
 },
 "output_hash": "sha256:136bb492428cfffbf71d5ed3c32ea495964331b927aad386a7e7dc68d3495dc8",
 "meta": {}
}